username;tweet;fecha;anuncio;ubicacion;id;sentimiento
moebiuseuler;alferdez horaciorlarreta kicillofok a todos sin distinciones politicas no es momento como ciudadana y aun con los errores y diferencias que sostengo con algunos relatos y otras realidades esgrimidas les agradezco las horas de trabajo en pos de la salud de los compatriotas;2020-07-17 17:01:22+00:00;Anuncio_9;Buenos Aires, Argentina;1284171346155581442;
gobideladrones;jamas un gesto de uds la lacra politica que tbn hagan un esfuerzo uds son la grieta devolve los depositos estoy sin trabajo y me dejaste sin mi dinero cuando un presidente q respete la ley el derecho a la propiedad como el sr presidente de uruguay luislacallepou;2020-07-17 17:00:55+00:00;Anuncio_9;Buenos Aires, Argentina;1284171232418713600;
alferdezprensa;buscamos que ningun argentino se quede sin atencion en salud y lo logramos cuando el sistema de salud se satura la mortalidad se duplica o triplica no queriamos pasar lo que pasaron en europa elegir quien se salvaba y quien se moria el presidente alferdez desde olivos;2020-07-17 16:58:11+00:00;Anuncio_9;Buenos Aires, Argentina;1284170545299435521;
isem20142015;que alegria haberlo votado albertogracias;2020-07-17 16:57:53+00:00;Anuncio_9;Buenos Aires, Argentina;1284170472217890816;
piluli1709;te amamos alberto sabemos el sacrificio que hace el gobierno;2020-07-17 16:57:37+00:00;Anuncio_9;Buenos Aires, Argentina;1284170402017796096;
NoraNorama56;clarisimo axel es con todos y entre todos vamos mi gobernador gracias kicillofok;2020-07-17 16:57:31+00:00;Anuncio_9;Buenos Aires, Argentina;1284170379192410117;
daniel_morgante;no te queda nada mas que decir del manual de las frases hechas;2020-07-17 16:56:25+00:00;Anuncio_9;Buenos Aires, Argentina;1284170101663637507;
Adrianavilda;por favor senor presidente no se olvide de los jubilados estamos pasando momentos muy dificiles haciendo todo lo que usted nos pide pero se hace muy dificil gracias;2020-07-17 16:55:52+00:00;Anuncio_9;Buenos Aires, Argentina;1284169964681932801;
alferdezprensa;argentina esta en una situacion comparativamente buena tiene ese resultado despues de un enorme esfuerzo tratar de preservar la vida de la gente pidiendole que se queden en sus casas porque el virus esta circulando entre nosotros el presidente alferdez desde olivos;2020-07-17 16:55:40+00:00;Anuncio_9;Buenos Aires, Argentina;1284169912567631873;
gabrielafeider1;alferdez alferdezprensa gracias;2020-07-17 16:55:08+00:00;Anuncio_9;Buenos Aires, Argentina;1284169777674674176;
yoteavise___;gracias por cuidarnos alberto espero que el pueblo sea responsable y no tengamos que volver a una cuarentena dura;2020-07-17 16:53:37+00:00;Anuncio_9;Buenos Aires, Argentina;1284169397444239360;
Blancaestigarr8;estoy viendo su conferencia que no abandonaria a personas que no trabajahace 8 meses k no trabajo ya no tengo comida no cobre ningun ife espero que me tenga en cuenta para el para el trabajo k ofrece del ingreso universal necesito trabajar gracias a mi hermano estoy viv;2020-07-17 16:53:28+00:00;Anuncio_9;Buenos Aires, Argentina;1284169359565426693;
Carlos4719;larreta miente transmitiendo la idea que la situacion esta controlada lo cierto es que estamos transitando el pico de la pandemia en estos momentos;2020-07-17 16:51:22+00:00;Anuncio_9;Buenos Aires, Argentina;1284168830403653632;
ubicateplis;te queremos presidente;2020-07-17 16:50:13+00:00;Anuncio_9;Buenos Aires, Argentina;1284168539373543424;
Canal9link;estamos muy lejos de pensar que la pandemia esta superada sostuvo el presidente alferdez alferdezprensa casarosada kicillofok horaciorlarreta jmcapitanich chacodetodos msalnacion ginesggarcia chacosalud arabelacarreras gerardomorales;2020-07-17 16:49:47+00:00;Anuncio_9;Buenos Aires, Argentina;1284168430028050433;
infonelida;presidente no es casual que ocupe ese sitio ud tiene una misionargentinasolo no se puede todos juntos mirando hacia adelantepor justicia salud educacion trabajo viviendas dignas inmunidad injusta basta ya todo el pueblo lo seguira;2020-07-17 16:48:38+00:00;Anuncio_9;Buenos Aires, Argentina;1284168141929578509;
Canal9link;la chaquena virginiariera hace historia en la elite del padel mundial chacodetodos alferdez alferdezprensa jmcapitanich idchdeportes worldpadeltour;2020-07-17 16:47:56+00:00;Anuncio_9;Buenos Aires, Argentina;1284167966884605957;
soniavidal2;te banco mucho alferdez;2020-07-17 16:47:23+00:00;Anuncio_9;Buenos Aires, Argentina;1284167827272990725;
Nicolas90018679;pero xq n te callas viejo del ortomiles de familias se estan muriendl de hambre boludoseguro q recibis ordenes de las elit de soros y sus secuasesviejo chanta;2020-07-17 16:47:15+00:00;Anuncio_9;Buenos Aires, Argentina;1284167796105121793;
SantDel1;nunca supiste como enfrentar la pandemia y menos la cuarentena consejo lo tenes al lado escuchalo a horaciorlarreta sabe y no habla tartamudeando;2020-07-17 16:46:52+00:00;Anuncio_9;Buenos Aires, Argentina;1284167699871014912;
carlosmiguez;un presidente que dice todes ya pierde seriedad queremos soluciones y no discursos y videos tribuneros se va a enojar victor hugo;2020-07-17 16:46:38+00:00;Anuncio_9;Buenos Aires, Argentina;1284167637082222594;
MiriamOreja;alferdezprensa kicillofok;2020-07-17 16:46:22+00:00;Anuncio_9;Buenos Aires, Argentina;1284167570518671360;
VecinosBelgrano;aha siempre lo supieron no gobiernodeinutiles;2020-07-17 16:46:00+00:00;Anuncio_9;Buenos Aires, Argentina;1284167477832880128;
NeritUlloa;nos gobierna un super hombre presidente;2020-07-17 16:45:31+00:00;Anuncio_9;Buenos Aires, Argentina;1284167356005199873;
PindongaCuchuf2;que necesidad de pelearte con el pais vasco haciendo comparaciones pelotudas hay que ser opa;2020-07-17 16:45:06+00:00;Anuncio_9;Buenos Aires, Argentina;1284167253370515465;
jakeinne1;y a ver si habla un poco de la economia de como vive la gente sin plata sin laburo la q perdio su negociohay ayuda o no hayno todos somos choriplaneros y cobramos 45 lucas;2020-07-17 16:43:43+00:00;Anuncio_9;Buenos Aires, Argentina;1284166906317017088;
Faby02704906;senor presidente nesecito su ayuda x favor somos 4 familias que injustamente son dejaron sin empleo en medio de la panaderia le pido disculpas x molestarlo con el gran trabajo que usted es haciendo pero no tenemos quien nos defienda gracias alferdez alferdezprensa;2020-07-17 16:43:43+00:00;Anuncio_9;Buenos Aires, Argentina;1284166905755054082;
ForzaPincha;siento que nos solto la mano nuestro respetado y querido presidente alferdez;2020-07-17 16:42:52+00:00;Anuncio_9;Buenos Aires, Argentina;1284166692856266752;
AngelCe33487924;buenos dias se noesto no es caprichos de nadie es una pandemia mantengase en su primer posiciona quien quiera contagiarse que se contagiepiense en todos los argenti nos que lo aprecia mos y amamos nues tro pais ejecute su plan crecer;2020-07-17 16:42:51+00:00;Anuncio_9;Buenos Aires, Argentina;1284166688309641220;
Ariel78084792;jeje ni foto tenes y exigencia al presidente que te conteste;2020-07-17 16:42:35+00:00;Anuncio_9;Buenos Aires, Argentina;1284166621003685889;
MartinMonutti;que hermoso pelotudo;2020-07-17 16:42:31+00:00;Anuncio_9;Buenos Aires, Argentina;1284166603542859776;
LuisFJimenez82;te banko presi no me baje los brazos;2020-07-17 16:42:30+00:00;Anuncio_9;Buenos Aires, Argentina;1284166599654735873;
linares1_marcos;un estado presente 9 millones de personas recibieron el ife 310000 pymes recibieron el atp 2800000 de trabajadorxs 438000 creditos tasa 0 con 6 meses de gracia argentinaunida argentinadepie alferdez alferdezprensa;2020-07-17 16:42:07+00:00;Anuncio_9;Buenos Aires, Argentina;1284166502695030784;
alferdezprensa;siempre supimos que habia que enfrentar una lucha larga nos hemos fijado una serie de objetivos que venimos cumpliendo y nos permite tener cierto optimismo en poder alcanzar los logros que nos hemos propuesto el presidente alferdez desde olivos;2020-07-17 16:40:49+00:00;Anuncio_9;Buenos Aires, Argentina;1284166176550072321;
DANIELDAMILANO;y aclaro que apoyo casi incondicionalmente al gobierno nacional y popular desde aca y como puedo;2020-07-17 16:40:24+00:00;Anuncio_9;Buenos Aires, Argentina;1284166069071089667;
martinezmarta32;no he perdido mas que la fe en que todo va a salir biencinco meses encerrada sin perspectiva de salir sin trabajo sin ayuda no a todos se les dio una mano;2020-07-17 16:40:13+00:00;Anuncio_9;Buenos Aires, Argentina;1284166022778494978;
DANIELDAMILANO;vivo en el pais vasco y lo que dice alberto es una estupidez que nunca ha ocurrido eso si ha pasado en madrid donde optaban quien vivia y quien no aqui nunca el sistema de salud se ha saturado verifica la data que esta errada;2020-07-17 16:39:31+00:00;Anuncio_9;Buenos Aires, Argentina;1284165846701690881;
reginalaurasosa;ese saludo me llego al alma;2020-07-17 16:37:53+00:00;Anuncio_9;Buenos Aires, Argentina;1284165436150632455;
SantDel1;no falta solidaridad en el pueblo presidente lo que falta es honestidad respetar las libertades personales propiedad privada falta investigar la korrupcion falta justicia;2020-07-17 16:36:45+00:00;Anuncio_9;Buenos Aires, Argentina;1284165152447827978;
danielcid1958;gracias alberto por cuidarnos;2020-07-17 16:36:22+00:00;Anuncio_9;Buenos Aires, Argentina;1284165056197021703;
FernandoAyalaj;el peor presidente de la historia hombredepaja;2020-07-17 16:35:50+00:00;Anuncio_9;Buenos Aires, Argentina;1284164919517216768;
Gustavo00344573;si quieren cuarentena denle a la gente los medios para subsistir 10mil cada dos meses es una verguenza yo cobro el 2do ife el 24 de julio no pidan q nos quedemos en casa si no tenemos para comer;2020-07-17 16:35:49+00:00;Anuncio_9;Buenos Aires, Argentina;1284164919064133638;
telefe;si hay que volver atras deberemos volver atras y si debemos ajustar mas ajustaremos mas confirmo alferdez alferdezprensa;2020-07-17 16:35:33+00:00;Anuncio_9;Buenos Aires, Argentina;1284164851770761219;
Christi53929911;vos sos un ladron hijo de puta come gatos;2020-07-17 16:35:33+00:00;Anuncio_9;Buenos Aires, Argentina;1284164847920455683;
Andrea20492268;mi eterna admiracion y respeto para ustd senor presidente;2020-07-17 16:35:32+00:00;Anuncio_9;Buenos Aires, Argentina;1284164846519541761;
CAROPLEIMLING;aguante c5n;2020-07-17 16:35:26+00:00;Anuncio_9;Buenos Aires, Argentina;1284164821097811972;
NancyToledo2907;sr presidente de la nacion dr alberto fernandez brillante su exposicion para preservar la salud de los argentinos exitoso el trabajo efectuado seguicuidandote argentinaunida;2020-07-17 16:34:39+00:00;Anuncio_9;Buenos Aires, Argentina;1284164622476546048;
carolinafi1990;alberto como haces para twittear mientras das cadena nacional superhombre;2020-07-17 16:34:34+00:00;Anuncio_9;Buenos Aires, Argentina;1284164603019173890;
FabianLikar;lo felicito senor presidente lo apoyo en todo lo que esta haciendo por fin volvimos a tener un presidente inteligente y que sepa hablar y explicar todo lo que nos esta pasando;2020-07-17 16:34:31+00:00;Anuncio_9;Buenos Aires, Argentina;1284164591031918592;
DanielDotm;un jubilado cobra la minima y paga 10 mil pesos de alquiler a esos ayudaras o por ser viejos que se jodan;2020-07-17 16:34:20+00:00;Anuncio_9;Buenos Aires, Argentina;1284164545641054208;
18Viktor;y vos estas agrandando la brecha con las mentiras y los enganos hambre es lo que hay y solucion es lo que espera el pueblo;2020-07-17 16:33:57+00:00;Anuncio_9;Buenos Aires, Argentina;1284164448899543042;
Musica_Arg;deberia contestar alferdez alferdezprensa;2020-07-17 16:33:30+00:00;Anuncio_9;Buenos Aires, Argentina;1284164332176146436;
pkitatonks;muchas fuerzas presidente gracias por el esfuerzo qie hace para cuidarnos;2020-07-17 16:33:15+00:00;Anuncio_9;Buenos Aires, Argentina;1284164269303640065;
queensasi;y cortaron avenidabrasil para esto hace rato ya me puse a ver elgourmet;2020-07-17 16:32:54+00:00;Anuncio_9;Buenos Aires, Argentina;1284164182645059584;
alferdezprensa;mi solidaridad con aquellos que han perdido seres queridos en este tiempo como consecuencia de este virus mi afecto mi carino y mi compromiso para todos ustedes no son numeros son hombres y mujeres que nos abandonan el presidente alferdez desde olivos;2020-07-17 16:32:21+00:00;Anuncio_9;Buenos Aires, Argentina;1284164043532644353;
telefe;ahora entre el 18 de julio y el 2 de agosto vamos a ir tratando de volver a la vida habitual en este nuevo mundo aseguro alferdez alferdezprensa;2020-07-17 16:31:53+00:00;Anuncio_9;Buenos Aires, Argentina;1284163925349740546;
telefe;efectivamente desde junio en adelante hubo un pico de crecimiento de las muertes que obviamente se condice con los contagios explico el presidente alferdez alferdezprensa;2020-07-17 16:30:30+00:00;Anuncio_9;Buenos Aires, Argentina;1284163579273515009;
Loregenoves;acomodar a familiares amigos hijos etc por la funcion que tenes esta mal alferdez alferdezprensa clarincom infobae frentedetodos politicabarata esta es la grieta cuando se aduenan del dinero publico;2020-07-17 16:30:03+00:00;Anuncio_9;Buenos Aires, Argentina;1284163464127295493;
Loregenoves;acomodar a familiares amigos hijos etc por la funcion que tenes esta mal alferdez alferdezprensa clarincom infobae frentedetodos politicabarata esta es la grieta cuando se aduenan del poder y el dinero publico estanislaoferok;2020-07-17 16:29:50+00:00;Anuncio_9;Buenos Aires, Argentina;1284163412671582208;
HHTaboada;podrido;2020-07-17 16:29:36+00:00;Anuncio_9;Buenos Aires, Argentina;1284163352135110657;
Santiag82359624;el esfuerzo sirvo segui cuidandote alferdez alferdezprensa;2020-07-17 16:29:05+00:00;Anuncio_9;Buenos Aires, Argentina;1284163223554609158;
AraosSepulveda;si el presidente de argentina alferdez alferdezprensa crio formo educo a su hijo y el resultado es esto no se si tendra la capacidad para liderar y sacarse de encima a la chorra de america la sra k argentina merece lo mejor no puede estar en la mierda tanto tiempo;2020-07-17 16:28:28+00:00;Anuncio_9;Buenos Aires, Argentina;1284163068663148549;
ThiagoM00046096;buen dia senor ayer le mande un twit podria verlo muchas gracias;2020-07-17 16:27:56+00:00;Anuncio_9;Buenos Aires, Argentina;1284162933388447746;
Juliy_3773;y aca vemos a k5n evitando el lenguaje de senas y tapandolo con su enoooorme graph por que no hace como tn o a24 que si saben achicar su zocalos para que las senas se puedan apreciar mejor;2020-07-17 16:27:17+00:00;Anuncio_9;Buenos Aires, Argentina;1284162770771083264;
alferdezprensa;todos nosotros hubieramos querido poder dedicarnos a avanzar en la prosperidad que la argentina necesita si hay alguien que quiere que la pandemia se termine ese alguien soy yo el presidente alferdez desde olivos;2020-07-17 16:26:59+00:00;Anuncio_9;Buenos Aires, Argentina;1284162693918842881;
MiriamOreja;alferdez alferdezprensa ayer en el programa de adn se hablo de la ocupacion de camas de uti los hospitales de caba estan trabajando a cama caliente se afirmo ejemplo hospital durand fernandez santojanni no permitan q mienta u oculte la realidad horaciorlarreta;2020-07-17 16:26:05+00:00;Anuncio_9;Buenos Aires, Argentina;1284162466214289410;
medinalaurab;todos todas y todes alferdezprensa y ahora que se va a poner el panuelo verde felizviernesatodos;2020-07-17 16:25:38+00:00;Anuncio_9;Buenos Aires, Argentina;1284162354394038273;
RedLizardking;veni a la matanza desde q empezo la cuarentena es una fiesta sin q los medios incentiven nada;2020-07-17 16:25:31+00:00;Anuncio_9;Buenos Aires, Argentina;1284162323901554688;
Edna_CSandoval;alferdezprensa argentina un ejemplo a seguir;2020-07-17 16:24:10+00:00;Anuncio_9;Buenos Aires, Argentina;1284161984884244481;
Santiag82359624;gracias alferdez alferdezprensa fuerza senor presidente;2020-07-17 16:24:04+00:00;Anuncio_9;Buenos Aires, Argentina;1284161959781441542;
garciacelina;alferdezprensa no necesitamos q nos explique lo q podemos ver escuchar en radiotv queremos q nos diga que van hacer 120 dias y todavia no pensaron;2020-07-17 16:24:00+00:00;Anuncio_9;Buenos Aires, Argentina;1284161944405016576;
biancacar1;ponele;2020-07-17 16:23:38+00:00;Anuncio_9;Buenos Aires, Argentina;1284161850788192261;
demardel176;mar del plata 2500 de aumento en 10 dias alferdez alferdezprensa kicillofok;2020-07-17 16:23:32+00:00;Anuncio_9;Buenos Aires, Argentina;1284161823869198337;
telefe;estamos muy lejos de pensar que la situacion esta superada y necesitamos tener presente que el riesgo esta todavia latente y no es que este concentrado solo en el amba confirmo alferdezprensa;2020-07-17 16:22:46+00:00;Anuncio_9;Buenos Aires, Argentina;1284161633447813122;
MiriamOreja;alferdezprensa cfkargentina atencion el gobernador d la provincia d cordoba oculta informacion abrio bares restaurantes llego a fase 5 y ahora cerro todo durante las ultimas 48 horas y continuan las restricciones porque se dispararon los casos jschiaretti es macri;2020-07-17 16:22:05+00:00;Anuncio_9;Buenos Aires, Argentina;1284161459350654980;
Lucasbareiro3;sigan incentivando para que la gente salga;2020-07-17 16:19:56+00:00;Anuncio_9;Buenos Aires, Argentina;1284160920814526464;
PoliticaChubut;el presidente anuncia la reapertura de la cuarentena en el amba alferdez alferdezprensa amba cuarentena covid19;2020-07-17 16:19:46+00:00;Anuncio_9;Buenos Aires, Argentina;1284160876350771200;
telefe;el esfuerzo es tratar de preservar la vida de la gente dijo alferdez y detallo los numeros actuales en el pais alferdezprensa;2020-07-17 16:19:08+00:00;Anuncio_9;Buenos Aires, Argentina;1284160720003792901;
Hotstreetsummer;empezo el 3 de marzo y recien actuaste el 20 de marzo alferdez hoy vas a dar otro mal paso dejando que los hippie con osde salgan a correr a pesar que la pelicula de hoy se hizo un mes atras segun fernanquirosba este era el rodaje ministro no tienen madre hdp;2020-07-17 16:18:56+00:00;Anuncio_9;Buenos Aires, Argentina;1284160668963397633;
Alimartolaba;sabinafrederic alferdezprensa;2020-07-17 16:15:58+00:00;Anuncio_9;Buenos Aires, Argentina;1284159921995554816;
telefe;nosotros siempre supimos que tenemos que enfrentar una lucha larga que esto no es simple que sabemos cuando empezo pero no sabemos cuando termina aseguro el presidente alferdez alferdezprensa;2020-07-17 16:14:43+00:00;Anuncio_9;Buenos Aires, Argentina;1284159608542638086;
UTE_Cordoba;alertaescolares cordoba gracias a los diputados nacionales que se han interiorizado con nuestra problematica y han presentado este proyecto de declaracion de emergencia para los transportistas escolares de todo el pais mariomeoni alferdezprensa alferdez licdanielarroyo;2020-07-17 16:13:11+00:00;Anuncio_9;Buenos Aires, Argentina;1284159222893158401;
IUniversidades;en apoyo al sector educativo para que se puedan brindar clases online y mas herramientas que necesitan una institucion de educacion media o superior hemos liberado los servicios de esperamos ampliar detalles con educacionar trottanico alferdezprensa;2020-07-17 16:08:06+00:00;Anuncio_9;Buenos Aires, Argentina;1284157940996374529;
CFArgentine;eso es democracia segun af alferdezprensa;2020-07-17 16:07:52+00:00;Anuncio_9;Buenos Aires, Argentina;1284157882687201281;
maralebra;tiene la suerte de no deber pagar alquiler xk desempleada may de 50 sin hijos pagando alquiler el ife no te alcanza pa comer alquiler y hacer emprendimiento ademas q en la flia seguro tienen auh progresar hogar sumar alimentar caraduras alferez alferdezprensa;2020-07-17 16:07:43+00:00;Anuncio_9;Buenos Aires, Argentina;1284157845370556423;
CharlyRosar;domingo natalio maiocco a este sin verguenza cobrenle los operativos no gasten mas recursos en apagar los incendios sino en castigar a este tipo a sus complices y a todos alferdez alferdezprensa juancabandie;2020-07-17 16:05:40+00:00;Anuncio_9;Buenos Aires, Argentina;1284157330020540427;
xfv;si este gobierno fuera cristinista no hubiera reculado en todo nos gobierna el f renovador y por eso la pasamos como el orto;2020-07-17 16:05:20+00:00;Anuncio_9;Buenos Aires, Argentina;1284157247267000320;
josegallegos69;alferdez alferdezprensa todonoticias a24com americatv eltreceoficial adrianventuratv edufeiok;2020-07-17 15:59:30+00:00;Anuncio_9;Buenos Aires, Argentina;1284155776848875520;
MiguelPuchiok;informo a mario pereyra cadena3com y a adsimioni que les guste o nooel presidente alferdez alferdezprensa tiene mandato hasta 101223 hasta esa fecha va ha estar y gobernar con todos los poderes constitucionales dejen de inventar culebrones y alguna vez sean objetivos;2020-07-17 15:57:18+00:00;Anuncio_9;Buenos Aires, Argentina;1284155223037091840;
MiriamOreja;c5n alferdezprensa fllorenteantoni;2020-07-17 15:54:53+00:00;Anuncio_9;Buenos Aires, Argentina;1284154616456916997;
Alimartolaba;santicafiero alferdezprensa alferdez como es la cuestion hay o no cuarentena;2020-07-17 15:54:31+00:00;Anuncio_9;Buenos Aires, Argentina;1284154524488404992;
AdrianaKauffer;tocamos fondo alertaescolares mariomeoni alferdez alferdezprensa ingridjetter kicillofok sergiomassa malenamassa danielbrue;2020-07-17 15:54:10+00:00;Anuncio_9;Buenos Aires, Argentina;1284154434491240448;
josehtango;usted esta apoyando a los delincuentes ahora le hiso a lazaro baez realmente me revuelven el estomago;2020-07-17 15:48:55+00:00;Anuncio_9;Buenos Aires, Argentina;1284153115437129728;
ElDemodelo2;alferdezprensa les meten a anibaul por la ventana mas agachados noesiste;2020-07-17 15:31:02+00:00;Anuncio_9;Buenos Aires, Argentina;1284148612616925185;
AdolfogusResist;siempre con el ejemplo justo diputadostodos diputadosar diputadosucr mxdiputados senadoargentina bloqueucr cfkargentina sergiomassa kicillofok poderjudicialpy cmagistratura alferdezprensa cijudicial clarincom lanacion prensarural scjn;2020-07-17 15:07:27+00:00;Anuncio_9;Buenos Aires, Argentina;1284142680809902081;
AdolfogusResist;no tiene verguenza diputadostodos diputadosar diputadosucr mxdiputados senadoargentina bloqueucr cfkargentina sergiomassa kicillofok poderjudicialpy cmagistratura alferdezprensa cijudicial clarincom lanacion prensarural scjn;2020-07-17 15:06:28+00:00;Anuncio_9;Buenos Aires, Argentina;1284142433081724928;
AdolfogusResist;daniel procesado por extorsion diputadostodos diputadosar diputadosucr mxdiputados senadoargentina bloqueucr cfkargentina sergiomassa kicillofok poderjudicialpy cmagistratura alferdezprensa cijudicial clarincom lanacion prensarural scjn dalessiogate;2020-07-17 14:57:59+00:00;Anuncio_9;Buenos Aires, Argentina;1284140296595480576;
AdolfogusResist;sin ella se mueren de hambre diputadostodos diputadosar diputadosucr mxdiputados senadoargentina bloqueucr cfkargentina sergiomassa kicillofok poderjudicialpy cmagistratura alferdezprensa cijudicial clarincom lanacion prensarural scjn bien su silencio;2020-07-17 14:56:52+00:00;Anuncio_9;Buenos Aires, Argentina;1284140015216467970;
u_americo;me mueve el pido que funcionsriosmantengan contactos con ex gibernantes procesado en sus psisescuando en su municipios yo pcias lagente necesita trabajo pospandemia de eso nada gracias;2020-07-17 14:56:51+00:00;Anuncio_9;Buenos Aires, Argentina;1284140012985110529;
Lauqui94;casarosada alferdezprensa alferdez;2020-07-17 14:54:17+00:00;Anuncio_9;Buenos Aires, Argentina;1284139365854306305;
ErnestoTravolta;y abren la cuarentena alferdezprensa horaciorlarreta;2020-07-17 14:52:02+00:00;Anuncio_9;Buenos Aires, Argentina;1284138800273391618;
desconcierto6;alferdezprensa necesita dinero y dolares a todos los gremialista ya explotan a su pueblo amenazan coimeros senor presidente moyano esta intervenido a empresas que dan trabajos al pueblo argentino y usted que hace se calla la boca ya el pueblo se cansa de tanta corrupcion;2020-07-17 14:42:45+00:00;Anuncio_9;Buenos Aires, Argentina;1284136464524234753;
Musica_Arg;alferdez ha llegado al piso mas bajo que puede habery cree q cfk lo va a levantarnoella baila sobre los muertos recuerdan alferdezprensa;2020-07-17 14:41:34+00:00;Anuncio_9;Buenos Aires, Argentina;1284136164568510471;
pedrohelen;horaciorlarreta cfkargentina kicillofok alferdezprensa gracias por destruirnos por poder politico;2020-07-17 14:41:31+00:00;Anuncio_9;Buenos Aires, Argentina;1284136154435063808;
desconcierto6;alferdezprensa yo pregunto no estara ya comprado moyano a los del ministrerio de trabajo de la nacion yo me presentaria con fiscales abogados y estar grabandolo todo y las empresas que extorcionan presidente tiene que acabar estos gremialistas y presente la auditoria a estos;2020-07-17 14:36:55+00:00;Anuncio_9;Buenos Aires, Argentina;1284134996324880385;
sergiopeinador;alberto viste el chico que entrena en la pileta casera de nylon que le fabrico su papa en su casa para competir internacionalmente por argentinarecibilo y prestale la pileta de olivos o conseguile una;2020-07-17 14:32:52+00:00;Anuncio_9;Buenos Aires, Argentina;1284133973598363649;
adribeager;alferdezprensa senor presidente con todo respeto no acepte las presiones de caba para flexibilizar los datos le dan la razon a mantener la cuarentena estricta quienes se quejan lo seguiran haciendo pero usted tiene mas apoyo del que cree mi agradecimiento;2020-07-17 14:28:14+00:00;Anuncio_9;Buenos Aires, Argentina;1284132808408129537;
Lidia12552608;un aplauso para mi presidente;2020-07-17 14:23:09+00:00;Anuncio_9;Buenos Aires, Argentina;1284131531360018433;
ConstanzaRamos2;no olvidar q alferdezprensa le tiene miedo a moyano;2020-07-17 14:22:55+00:00;Anuncio_9;Buenos Aires, Argentina;1284131470416715777;
Canal9link;con jmcapitanich presente alferdez finalmente anunciara en vivo la nueva cuarentena alferdezprensa chacodetodos kicillofok horaciorlarreta msalnacion casarosada arabelacarreras gerardomorales chacosalud;2020-07-17 14:14:53+00:00;Anuncio_9;Buenos Aires, Argentina;1284129449961824257;
Walter19838;es mas al menos en mardel ni abogacia podes hacer a distancia que sean solo a distancia y ahorras infraestructura y le facilitas la vida a los estudiantes ya que van a poder trabajar y estudiar;2020-07-17 13:50:15+00:00;Anuncio_9;Buenos Aires, Argentina;1284123249195069441;
