username;tweet;fecha;anuncio;ubicacion;id;sentimiento
KariArgentina84;orgullo de que que diarios y noticias ve estamos viendo como hunden el pais compras con sobreprecio medicos cubanos la maquinita imprimiendo los presos se quieren liberar la anses no labura el senado tampoconos hundimos senora y el capitan del barco lo sabe;2020-04-25 10:45:07+00:00;Anuncio_4;Buenos Aires, Argentina;1253998466096943104;
KariArgentina84;no queremos el fracaso senora ya fracasamos ya se fue a pique la argentina y recien empieza esto levante la cuarentena presi el hambre es la mayor pandemia no el coronavirus;2020-04-25 10:34:29+00:00;Anuncio_4;Buenos Aires, Argentina;1253995790114185217;
KariArgentina84;claro es el acuerdo que hizo con soros nos encierra le vende al mundo que es un lider manejando la pandemia a cambio de nos vendio urgente tiene que levantar la cuarentena no se puede extender es injustificable;2020-04-25 10:19:29+00:00;Anuncio_4;Buenos Aires, Argentina;1253992017866248196;
GustavoWilhelm3;alferdezprensa haganselo llegar al sr presidente;2020-04-25 09:43:55+00:00;Anuncio_4;Buenos Aires, Argentina;1253983067863232516;
Vale58373166;alferdezprensa alferdez hablale a los pibes y pibas que necesitan salir del encierro mi hijo y mi hija con 4 y 7 anos lo esperan tanto como papa noel a sacar al perro sobre la misma cuadra de casa con eso ya son felices;2020-04-25 08:42:47+00:00;Anuncio_4;Buenos Aires, Argentina;1253967682623475713;
noestanadadicho;si leyeran los comentarios verian a la gente de moron hablando de como se revalorizo la zona con el aeropuerto y que viene a hablar de la zona como si aeroparque estuviese en un descampado cuando esta en el medio de caba esto es otro intento de monopolio k;2020-04-25 08:31:41+00:00;Anuncio_4;Buenos Aires, Argentina;1253964889699364865;
Manuela28800357;sr presidente en san juan no respetan sus decretos a exeptuados mi esposo esta aislado en un hotel y no recibio asistencia medica y vieron la documentacion que acredita su trabajo pido por favor una respuesta;2020-04-25 08:15:33+00:00;Anuncio_4;Buenos Aires, Argentina;1253960828128280576;
alyxfaderland;no quieres matar ya lo sabemos pero quedate tranquilo mataste a dos en cordoba liliana y laura sos un asesino;2020-04-25 08:11:49+00:00;Anuncio_4;Buenos Aires, Argentina;1253959886448267264;
alyxfaderland;y los q desde hace un mes tenemos dolencias domores q nos pueden ni miras de ver un turno despues de este atrasodegcuanto mas nos haras sufrir o tenemos q salir a contagiarnos para q nos atuendan cuantos moriran x un sistema sanitario fundido y a favor de las prepagas;2020-04-25 08:11:29+00:00;Anuncio_4;Buenos Aires, Argentina;1253959804688662528;
alyxfaderland;te equivocaste con muchas normas y de cabezon y tozudo no escuchas halagos si pero mataste la mataron tus normas absurdas negar un pase a una trasplantada echarla de un centro x no tener covid esos son tus exoertos se llamaba laura apyesto q no llamas a su familia;2020-04-25 08:08:53+00:00;Anuncio_4;Buenos Aires, Argentina;1253959151736233986;
alyxfaderland;q te asesoren mejor si no tenes coronavirus no vengas y asiuna vida en cordoba no vuelve 24 anos y todo lo q se oerdio porque no le dieton autorizacion a viajar csu medicorutas militarizadas q tratan como si fuera ejdrcito enemigo murio no vuelve;2020-04-25 08:06:18+00:00;Anuncio_4;Buenos Aires, Argentina;1253958499429683200;
Rodri_ellemberg;nooo yo le hago caso a alferdezprensa;2020-04-25 06:54:09+00:00;Anuncio_4;Buenos Aires, Argentina;1253940343642492929;
salome_clau;alferdez ginesggarcia kicillofok msalnacion minfrapba alferdezprensa mininteriorar por favor son 51 medicos ecuatoriano que no pudieron regresar y son parte de nuestro personal de salud en argentina los necesitamos y quieren regresar;2020-04-25 06:16:32+00:00;Anuncio_4;Buenos Aires, Argentina;1253930878146920449;
AutenticoEp;la repuesta no es la adecuada y te estas arrogando un lugar que no te corresponde hay un opinologo en cada esquina por eso la preguntas fue dirigida directamente al presidente;2020-04-25 06:16:05+00:00;Anuncio_4;Buenos Aires, Argentina;1253930763847901186;
Bichytina;te lo respondo yo el tapaboca no es un barbijo para q el virus no pase de tu garganta a una superficie debe tener un poro de 02 nm desde q se implemento el tapaboca no vi una sola persona q no se lo toque es mas una medida psicologica q eficaz;2020-04-25 05:49:20+00:00;Anuncio_4;Buenos Aires, Argentina;1253924031390273536;
RSQuesada;sinverguenza tenes la cara de piedra;2020-04-25 05:24:26+00:00;Anuncio_4;Buenos Aires, Argentina;1253917763917287426;
RSQuesada;si que les saquen mas dinero a los 12 millones que trabajan pero a nostrosbebbel gobierno que no nos toquen un centavo sino pobres;2020-04-25 05:23:50+00:00;Anuncio_4;Buenos Aires, Argentina;1253917613283053569;
RSQuesada;preguntenle a fernandez como fue el arreglo que hizo con cristina para salvarla de las rejas;2020-04-25 05:21:23+00:00;Anuncio_4;Buenos Aires, Argentina;1253916995738906629;
RSQuesada;nadie sabes mas que vos y cristina uds le ensenaron a mundo todo lo que saben por eso usa y europa esta tan mal y argentina es una potencia;2020-04-25 05:20:30+00:00;Anuncio_4;Buenos Aires, Argentina;1253916776334798849;
RSQuesada;alferdezprensa bravo genio ahora q el pais esta abajo abandonas la posibilidad de futuros acuerdos a traves del mercosur en un momento en el que mas se necesitara el comercio para salir adelante la que nos espera con uds que inutiles;2020-04-25 05:18:52+00:00;Anuncio_4;Buenos Aires, Argentina;1253916363367886848;
DeliaGomezok;basta de liberar delincuentes sabinafrederic santicafiero pietragallahora mininteriorar alferdez alferdezprensa cfkargentina;2020-04-25 05:10:42+00:00;Anuncio_4;Buenos Aires, Argentina;1253914310859948032;
hroquecg;pesima decision otra vez cristina x q no estan sus amigo otra vez la influencia de los marxistas de la campora otra vez flojisimo el entorno de alferdez alferdezprensa;2020-04-25 04:45:19+00:00;Anuncio_4;Buenos Aires, Argentina;1253907920590442497;
PaulaBentolila;en un total de acuerdo msalnacion ginesggarcia alferdez alferdezprensa;2020-04-25 04:27:51+00:00;Anuncio_4;Buenos Aires, Argentina;1253903524544602112;
NataliaTitos;alferdezprensa podre traer a mi queridisima ciudad de caleta olivia provincia de santa cruz algun mensaje del sr presidente alferdez mas precisamente a canal 2 caleta video cable srl que me dice presi;2020-04-25 03:53:03+00:00;Anuncio_4;Buenos Aires, Argentina;1253894768830156800;
carolin82222614;entre ellos se entienden alferdezprensa alferdez cfkargentina crisnoticias mauriciomacri mlousteau2019 todonoticias edufeiok clarincom alfleuco agencialavieja cuervotinelli buryailericardo patobullrich;2020-04-25 03:48:22+00:00;Anuncio_4;Buenos Aires, Argentina;1253893587110113280;
carolin82222614;por supuesto todos los reos tienen los mismos derechos alferdezprensa alferdez cfkargentina crisnoticias mauriciomacri mlousteau2019 todonoticias edufeiok clarincom alfleuco agencialavieja cuervotinelli buryailericardo patobullrich;2020-04-25 03:47:43+00:00;Anuncio_4;Buenos Aires, Argentina;1253893426552229889;
MecCiarlan;alferdez santicafiero licdanielarroyo hemos puesto en su conocimiento las necesidades del sector al que representamos el tiempo corre y los monotributistas no comen mesa de dialogo para marayanoestassolo urgente monotributistasenemergencia estaninformados respuestaya;2020-04-25 03:45:28+00:00;Anuncio_4;Buenos Aires, Argentina;1253892857741619202;
TUYOMIQUERER;alferdez alferdezprensa pontifexes por amor a cristo senor alberto presidente d los argentinos permita a los varados en exterior estar en argentina mi hijo de usa llego a mexico y espera regresar a casa como estaria ud asi estoy yo x favoorr;2020-04-25 03:44:21+00:00;Anuncio_4;Buenos Aires, Argentina;1253892579743105027;
PaulaBentolila;estan queriendo tener que volver todo para atras o demostrar que lo invertido en camas y respiradores y los medicos cubanos se va a utilizar ya x favor conlosninosno sigamos cuidando a todos x igual ginesggarcia msalnacion alferdez alferdezprensa omarperotti;2020-04-25 03:31:48+00:00;Anuncio_4;Buenos Aires, Argentina;1253889418689163264;
tugranoenelorto;es en serio eso estan haciendo y para que tienen las mascaras de la empresa liliana y todas las donaciones asesinospablojavkin omarperotti alferdezprensa alferdez pamiorgar;2020-04-25 03:29:36+00:00;Anuncio_4;Buenos Aires, Argentina;1253888865217196032;
hernanmassetti;y vos sos un pobre pelotudo novuelvenmas;2020-04-25 03:08:31+00:00;Anuncio_4;Buenos Aires, Argentina;1253883559452049409;
andreita28;sr presidente no les den la domiciliaria a todas esas personas que deliberadamente y en pleno ejercicio de sus facultades hicieron algun tipo de dano a la sociedad;2020-04-25 02:56:42+00:00;Anuncio_4;Buenos Aires, Argentina;1253880587053563904;
martabazzone;ya que esta haciendo eso senor presidentes acuerdese de los trabajadores de limpieza que trabajaron toda la cuarentenay ganan una miseria;2020-04-25 02:47:19+00:00;Anuncio_4;Buenos Aires, Argentina;1253878226394497029;
aigaribay;por favor necesitamos volver a casa a cumplir con la cuarentena necesitamos un cronograma de vuelos nos esta matando esta incertidumbre;2020-04-25 02:33:12+00:00;Anuncio_4;Buenos Aires, Argentina;1253874673646997504;
9020Laura;no se negocia con delincuentes alferdez alferdezprensa;2020-04-25 02:21:44+00:00;Anuncio_4;Buenos Aires, Argentina;1253871788729290753;
susipol67;bueno lo votaron;2020-04-25 02:07:07+00:00;Anuncio_4;Buenos Aires, Argentina;1253868110211358721;
a1noticias;hace instantes arielsujarchuk y luanavolnovich supervisaron el operativo de traslado de 27 pacientes de la clinica san carlos intervenida por irregularidades sanitarias a la gestion municipal alferdez vhmok cronica alferdezprensa;2020-04-25 01:58:53+00:00;Anuncio_4;Buenos Aires, Argentina;1253866038288101381;
AtsOspe;americatv telefenoticias a24com todonoticias cronica educacionar alferdez kicillofok trottanico ginesggarcia cfkargentina alferdezprensa;2020-04-25 01:55:24+00:00;Anuncio_4;Buenos Aires, Argentina;1253865161464721410;
DanielaFunez17;alferdez aleberco alferdezprensa sergiomassa realmente no podemos pagar bajo este sistema q ajusta por inflacion menor ingreso perdida de trabajo etc etc los bancos felices cuarentenaextendida;2020-04-25 01:35:03+00:00;Anuncio_4;Buenos Aires, Argentina;1253860037405048834;
iglesiasgd;sehizojusticia correra sangre alferdez alferdezprensa;2020-04-25 01:17:33+00:00;Anuncio_4;Buenos Aires, Argentina;1253855632693788672;
ConLaGenteRos;coronavirusargentina el presidente mantuvo este viernes una extensa videoconferencia con los mandatarios se esperan anuncios sobre la continuidad del aislamiento en las proximas horas alferdez alferdezprensa msalnacion;2020-04-25 01:09:24+00:00;Anuncio_4;Buenos Aires, Argentina;1253853585743458306;
Majitoo013;hagamoslo viral no lo podemos permitir alferdez alferdezprensa con o sin pandemia te salimos a la calle si liberas a estos hdp gobiernodeinutiles;2020-04-25 00:52:19+00:00;Anuncio_4;Buenos Aires, Argentina;1253849283364864002;
PaulaBentolila;cabe alguna duda que dejar salir a los chicos no es conveniente alferdez alferdezprensa ginesggarcia radiofonica1007 cronicaseltrece;2020-04-25 00:51:31+00:00;Anuncio_4;Buenos Aires, Argentina;1253849082310860806;
IgnotaCreyente;algo mas alferdez a ver que otra ineptitud se te ocurre nos mandaste a tomar te caliente para curar el covid y completar una ddjj liberas presos dolar blue y mep arriba de 100 emitis pila de billetes sin numeracion que otra cosa se te ocurre para jodernos alferdezprensa;2020-04-25 00:51:29+00:00;Anuncio_4;Buenos Aires, Argentina;1253849075386126338;
ArchJaume;casarosada alferdezprensa no seas inutil y toma al toro por las bolas;2020-04-25 00:51:25+00:00;Anuncio_4;Buenos Aires, Argentina;1253849058428489728;
Majitoo013;alferdez alferdezprensa patobullrich horaciorlarreta que se viralice gobiernodeinutiles;2020-04-25 00:47:28+00:00;Anuncio_4;Buenos Aires, Argentina;1253848063141195785;
agustingomezatr;alferdez herrerayflia mauricloss;2020-04-25 00:43:48+00:00;Anuncio_4;Buenos Aires, Argentina;1253847141807722497;
LuanaDenisse;alferdezprensa alferdez herrerayflia;2020-04-25 00:39:21+00:00;Anuncio_4;Buenos Aires, Argentina;1253846021614043138;
mfernandaag;colegio emaus;2020-04-25 00:35:33+00:00;Anuncio_4;Buenos Aires, Argentina;1253845064595505152;
Pamela45623366;alferdezprensa mininteriorar mindetransporte maritoabdo mariomeoni cfkargentina alferdez felipesola argentinosvaradosenelexterior;2020-04-25 00:30:50+00:00;Anuncio_4;Buenos Aires, Argentina;1253843878391812097;
soxcar1972;los aviones salen para el rio en palomar salen hacia un colegio;2020-04-25 00:21:08+00:00;Anuncio_4;Buenos Aires, Argentina;1253841437227192321;
gabydelucia;felicitaciones chicas muy buena iniciativa trabajo solidaridario de esta hermosa juventud sdeamor2020;2020-04-25 00:19:56+00:00;Anuncio_4;Buenos Aires, Argentina;1253841135451213826;
24conurbano;alberto logro el aval de los gobernadores y se esperan detalles de la nueva fase de la cuarentena que anunciaran este sabado cuarentenafocalizada cuarentenaadministrada alferdezprensa;2020-04-25 00:17:24+00:00;Anuncio_4;Buenos Aires, Argentina;1253840498206351360;
Gonzalo84631850;felicitaciones x la gran iniciativa yproyecto solidarioa las alumnas escuela imainstituto maria auxiliadora trelew chubut alferdez alferdezprensa arcionimariano twamaderna ricsastre josgime27827861 leilalloyd gabydelucia elchubut jornadaweb barciaml;2020-04-25 00:15:46+00:00;Anuncio_4;Buenos Aires, Argentina;1253840084828291073;
mfernandaag;aeroparque tiene el rio que es una via de escape ante cualquier inconveniente aca un avion tendria que aterrizar en las casas si tiene algun problema se poblo despues del aeropuerto y ahora en el mundo no se construyen mas aeropuertos en zonas urbanas;2020-04-25 00:13:45+00:00;Anuncio_4;Buenos Aires, Argentina;1253839578420654081;
brevencuentro1;hagan lo que tengan que hacer las autoridades pero con los presos adentro nolosliberen alferdezprensa;2020-04-25 00:08:28+00:00;Anuncio_4;Buenos Aires, Argentina;1253838247882612736;
LMnuncaP;podra ser que el gobierno de cientificos ginesggarcia alferdezprensa le haya comprado a china test no homologados sabiendo que paises como espana habia devuelto compras de insumos por fallidas se mandaron la fantochada patriota con aerolineasar para esto sisi asi es;2020-04-25 00:04:53+00:00;Anuncio_4;Buenos Aires, Argentina;1253837347302637568;
Marilin75919067;prioridad los presos y los planeros el resto no existe;2020-04-25 00:03:58+00:00;Anuncio_4;Buenos Aires, Argentina;1253837117446393857;
albertoelma;alferdezprensa senor presidente el petroleo en el mas bajo precio del siglo pero la nafta y derivados de hidrocarburos no bajaron pero si nuestros sueldos porque senor;2020-04-25 00:03:53+00:00;Anuncio_4;Buenos Aires, Argentina;1253837095619252225;
BormidaLiliana;habla primero larreta alferdezprensa;2020-05-08 23:59:33+00:00;Anuncio_5;Buenos Aires, Argentina;1258909434979454976;
carolin82222614;ja ja jaaaaaa alferdezprensa alferdez cfkargentina crisnoticias mauriciomacri mlousteau2019 todonoticias edufeiok clarincom alfleuco agencialavieja cuervotinelli buryailericardo patobullrich;2020-05-08 23:58:44+00:00;Anuncio_5;Buenos Aires, Argentina;1258909227990614016;
BormidaLiliana;asi que cordoba esta muy bien alferdezprensa mira vos;2020-05-08 23:58:27+00:00;Anuncio_5;Buenos Aires, Argentina;1258909157241040902;
carolin82222614;vos tenes las manos sucias alferdezprensa alferdez alferdezprensa alferdez cfkargentina crisnoticias mauriciomacri mlousteau2019 todonoticias edufeiok clarincom alfleuco agencialavieja cuervotinelli buryailericardo patobullrich;2020-05-08 23:58:17+00:00;Anuncio_5;Buenos Aires, Argentina;1258909117848190977;
BormidaLiliana;alferdezprensa ya mezclo todo como tiene miedo a nombrar a larreta dice que solo el amba qyeds igual y despues agrega caba te tuercen el brazo alberto no te tiembla para joder jubilados y como habla directo con intendentes saltando vias;2020-05-08 23:57:28+00:00;Anuncio_5;Buenos Aires, Argentina;1258908911865864192;
carolin82222614;se cumplio tu deseo cornudo alferdezprensa alferdez cfkargentina crisnoticias mauriciomacri mlousteau2019 todonoticias edufeiok clarincom alfleuco agencialavieja cuervotinelli buryailericardo patobullrich;2020-05-08 23:57:20+00:00;Anuncio_5;Buenos Aires, Argentina;1258908877715841025;
carolin82222614;esta loco o me parece alferdezprensa alferdez cfkargentina crisnoticias mauriciomacri mlousteau2019 todonoticias edufeiok clarincom alfleuco agencialavieja cuervotinelli buryailericardo patobullrich;2020-05-08 23:56:41+00:00;Anuncio_5;Buenos Aires, Argentina;1258908713781547008;
carolin82222614;cierren las villas con perimetrales para que nadie salga alferdezprensa alferdez cfkargentina crisnoticias mauriciomacri mlousteau2019 todonoticias edufeiok clarincom alfleuco agencialavieja cuervotinelli buryailericardo patobullrich;2020-05-08 23:56:05+00:00;Anuncio_5;Buenos Aires, Argentina;1258908561079513089;
carolin82222614;hdp alferdezprensa alferdez cfkargentina crisnoticias mauriciomacri mlousteau2019 todonoticias edufeiok clarincom alfleuco agencialavieja cuervotinelli buryailericardo patobullrich;2020-05-08 23:55:11+00:00;Anuncio_5;Buenos Aires, Argentina;1258908337560846349;
carolin82222614;que no se meta con ciudad de bs as hdp alferdezprensa alferdez cfkargentina crisnoticias mauriciomacri mlousteau2019 todonoticias edufeiok clarincom alfleuco agencialavieja cuervotinelli buryailericardo patobullrich;2020-05-08 23:54:54+00:00;Anuncio_5;Buenos Aires, Argentina;1258908263908651008;
carolin82222614;en cualquier momento para la pata alferdezprensa alferdez cfkargentina crisnoticias mauriciomacri mlousteau2019 todonoticias edufeiok clarincom alfleuco agencialavieja cuervotinelli buryailericardo patobullrich;2020-05-08 23:54:30+00:00;Anuncio_5;Buenos Aires, Argentina;1258908164084432897;
carolin82222614;la marca en la cara es porque lo trompearon alferdezprensa alferdez cfkargentina crisnoticias mauriciomacri mlousteau2019 todonoticias edufeiok clarincom alfleuco agencialavieja cuervotinelli buryailericardo patobullrich;2020-05-08 23:54:14+00:00;Anuncio_5;Buenos Aires, Argentina;1258908098187665408;
BormidaLiliana;alberto tiene miedo a decir caba que marca que no lo logra el amba por favor y esa frase no me van a torcer el brazo ya fue para ye la torsietoon cuando ajustaste jubilados pedirnos y quf cruelmente lo haras en junio alferdezprensa tienen miedo a decir villas y geriatricos;2020-05-08 23:54:11+00:00;Anuncio_5;Buenos Aires, Argentina;1258908083486691328;
carolin82222614;bastar este viejo con las planillitas alferdezprensa alferdez cfkargentina crisnoticias mauriciomacri mlousteau2019 todonoticias edufeiok clarincom alfleuco agencialavieja cuervotinelli buryailericardo patobullrich;2020-05-08 23:53:41+00:00;Anuncio_5;Buenos Aires, Argentina;1258907957263294464;
KolinaNacional;el riesgo de la pandemia se concentra en el amba alferdezprensa;2020-05-08 23:52:53+00:00;Anuncio_5;Buenos Aires, Argentina;1258907758822330368;
alexfn_i;no me van a torcer el brazo alferdez alferdezprensa;2020-05-08 23:52:42+00:00;Anuncio_5;Buenos Aires, Argentina;1258907711871352835;
chococo_sup;los mas importantes en la pandemia covid19 pedimos un dnu sanitario ginesggarcia alferdezprensa msalnacion ayudalos y te ayudas a vos dale rt medicoscuidados cuidameparaquetecuide nonosdejensolos;2020-05-08 23:52:38+00:00;Anuncio_5;Buenos Aires, Argentina;1258907693961576449;
gabrielficini;hablemos de pais federal mientras vemos en la mayoria de las conferencias cuarentenistas a alferdezprensa kicillofok y horaciorlarreta nunca un gobernador del interior;2020-05-08 23:51:29+00:00;Anuncio_5;Buenos Aires, Argentina;1258907406731546624;
Federic22912449;alferdezprensa fijense el mic por momentos no se escucha;2020-05-08 23:50:46+00:00;Anuncio_5;Buenos Aires, Argentina;1258907226774867980;
Nicolasaltomar5;senor precidente le pido por favor re vea nuestro caso porque nos iban a dar lo suspendieron la ayuda yo cumplo la cuarentena como usted pidio ya no tengo recursos economico un peon de taxi si pudiera fijarse estaria muy agradecido;2020-05-08 23:49:22+00:00;Anuncio_5;Buenos Aires, Argentina;1258906871236354049;
carolin82222614;yo cambio de canal dice boludeces rebelion alferdezprensa alferdez cfkargentina crisnoticias mauriciomacri mlousteau2019 todonoticias edufeiok clarincom alfleuco agencialavieja cuervotinelli buryailericardo patobullrich;2020-05-08 23:49:18+00:00;Anuncio_5;Buenos Aires, Argentina;1258906855117672448;
AgnelliPardini;alferdezprensa nos soy votante del kirchnerismo no vote al presidente soy de caba y vote a cambiemos quiero que cuidemos a este estadista que es alberto fernandez y que nuestro jefe de gobierno que votamos mayoritariamente siga en su linea como lo hace un abrazo a todos;2020-05-08 23:49:14+00:00;Anuncio_5;Buenos Aires, Argentina;1258906838634057730;
rosaoavando;gracias presidente alberto;2020-05-08 23:48:34+00:00;Anuncio_5;Buenos Aires, Argentina;1258906671289597954;
carolin82222614;no podemos escuchar a este tipo alferdezprensa alferdez cfkargentina crisnoticias mauriciomacri mlousteau2019 todonoticias edufeiok clarincom alfleuco agencialavieja cuervotinelli buryailericardo patobullrich;2020-05-08 23:48:26+00:00;Anuncio_5;Buenos Aires, Argentina;1258906639744319495;
KolinaBsAs;voy a cuidar a la gente antes que nada albertotecuida alferdezprensa ahora;2020-05-08 23:48:21+00:00;Anuncio_5;Buenos Aires, Argentina;1258906618420477952;
carolin82222614;no te compares con usa hdp alferdezprensa alferdez cfkargentina crisnoticias mauriciomacri mlousteau2019 todonoticias edufeiok clarincom alfleuco agencialavieja cuervotinelli buryailericardo patobullrich;2020-05-08 23:48:12+00:00;Anuncio_5;Buenos Aires, Argentina;1258906577463017473;
carolin82222614;que mierda me importa noruega hdp alferdezprensa alferdez cfkargentina crisnoticias mauriciomacri mlousteau2019 todonoticias edufeiok clarincom alfleuco agencialavieja cuervotinelli buryailericardo patobullrich;2020-05-08 23:47:34+00:00;Anuncio_5;Buenos Aires, Argentina;1258906419920801792;
eugeniavivas;que dijo mama alberto ya puedo salir no se mi amor solo estoy escuchando lo importante es que alberto nos cuida alferdez alferdezprensa;2020-05-08 23:43:50+00:00;Anuncio_5;Buenos Aires, Argentina;1258905480816209920;
MargotRoca1;es muy triste y angustiante hay que prepararse para no permitir esta afrenta;2020-05-08 23:42:09+00:00;Anuncio_5;Buenos Aires, Argentina;1258905054934900737;
MM_MiAmor;hipicrita como te miente alferdez alferdezprensa se fue todo al carajo las calles estan llenas inbecil horaciorlarreta capital es un hervidero colas de gente en los comercios donde vive este infeliz edufeiok alfleuco c5n a24com todonoticias angeletchecopar;2020-05-08 23:38:50+00:00;Anuncio_5;Buenos Aires, Argentina;1258904222059372545;
ASarife;conmilibertadno yomecuido quiero un gobierno respetando la cn legislando como corresponde dejen de gobernar por dnu alferdezprensa alferdez casarosada diputadosar senadoargentina;2020-05-08 23:37:08+00:00;Anuncio_5;Buenos Aires, Argentina;1258903793581858816;
brevencuentro1;tvpublica tenemos que ver tn alferdezprensa por fin;2020-05-08 23:34:52+00:00;Anuncio_5;Buenos Aires, Argentina;1258903222464512000;
avicidomini;alferdez alferdezprensa santicafiero wadodecorrido martinmguzman martindonate;2020-05-08 23:28:42+00:00;Anuncio_5;Buenos Aires, Argentina;1258901672195227649;
MM_MiAmor;albertotecuida te cuida las pelotas la calle llena de viejos esto se fue al carajo alferdez alferdezprensa todonoticias horaciorlarreta barbaradiez agencialavieja angeletchecopar sergiomassa edufeiok a24com cuervotinelli italia un poroto;2020-05-08 23:27:16+00:00;Anuncio_5;Buenos Aires, Argentina;1258901313208942595;
MM_MiAmor;la calle esta llena de gente y muchisima gente mayor sin barbijos horaciorlarreta alferdezprensa angeletchecopar edufeiok c5n todonoticias a24com agencialavieja atlanticsurff cuervotinelli chauoperetak esto se esta llendo al carajo conmilibertadno 8mayo;2020-05-08 23:24:39+00:00;Anuncio_5;Buenos Aires, Argentina;1258900651804897280;
DiosaMane;alberto fernandez los que gobiernan son cuidadosos los otros escriben en twitter alferdez alferdezprensa cfkargentina parece pero no siempre se es hombre de palabra;2020-05-08 23:24:10+00:00;Anuncio_5;Buenos Aires, Argentina;1258900532254724096;
AleBG__71;senadoargentina diputadosar hcdiputadosba legiscaba casarosada alferdez alferdezprensa cfkargentina les queda claro o les hacemos un dibujito cmagistratura cortesupremaar;2020-05-08 23:18:43+00:00;Anuncio_5;Buenos Aires, Argentina;1258899158431404032;
DiosaMane;ups alferdez alferdezprensa gabicerru las cosas que se dicen no se borran jamas para bien o para mal dificil volver a confiar quien traiciona;2020-05-08 23:15:30+00:00;Anuncio_5;Buenos Aires, Argentina;1258898348146335747;
GLVERONICA;10 min en la plaza te lo pide benito alferdezprensa alferdez;2020-05-08 23:09:26+00:00;Anuncio_5;Buenos Aires, Argentina;1258896822178807808;
LGavoto;alferdez alferdezprensa msalnacion vamos a gritar cada vez mas fuerte les estamos mostrando la realidad nada mas contundente que eso medicoscuidados cuidameparaquetecuide nosomosheroessomostrabajadores;2020-05-08 23:02:47+00:00;Anuncio_5;Buenos Aires, Argentina;1258895151340105729;
CansadaDra;basta no podemos mas necesitamos dnu sanitario medicoscuidados cuidameparaquetecuide ayudanos y dale rt alferdez alferdezprensa argmedicos;2020-05-08 23:01:05+00:00;Anuncio_5;Buenos Aires, Argentina;1258894721738563586;
santiagojoseok1;en minutos habla el presidente hagamos nuestro esfuerzo e interpretemos bien el mensaje alferdez alferdezprensa;2020-05-08 22:58:46+00:00;Anuncio_5;Buenos Aires, Argentina;1258894140877811716;
Moni_en_SG;ponen a los chicos en manos de esa delirante elpeorpresidentedelmundo;2020-05-08 22:58:27+00:00;Anuncio_5;Buenos Aires, Argentina;1258894059365523456;
